{
  "$schema": "https://json-schema.org/draft/2020-12/schema",
  "$id": "https://lumen.demo/schemas/affected.schema.json",
  "version": 1,
  "title": "Affected",
  "description": "Output of find_affected (team rules, Rule 3). rank_patients and match read now and window from it.",
  "type": "object",
  "additionalProperties": false,
  "required": [
    "closed_clinic_ids",
    "sessions",
    "home_in_outage",
    "mode",
    "lead_hours",
    "now",
    "window"
  ],
  "properties": {
    "closed_clinic_ids": {
      "type": "array",
      "uniqueItems": true,
      "items": {
        "type": "string",
        "pattern": "^(C|H)\\d{2}$"
      },
      "description": "Clinics inside the outage polygon whose backup_power is not full."
    },
    "sessions": {
      "type": "array",
      "items": {
        "$ref": "#/$defs/session"
      },
      "description": "Sessions at a closed clinic that overlap the window: start < window end and end > window start."
    },
    "home_in_outage": {
      "type": "object",
      "additionalProperties": {
        "type": "boolean"
      },
      "description": "Every patient ID; true when the home is inside the polygon."
    },
    "mode": {
      "type": "string",
      "enum": [
        "early",
        "transfer",
        "critical"
      ]
    },
    "lead_hours": {
      "type": "number"
    },
    "now": {
      "$ref": "#/$defs/timestamp",
      "description": "The demo clock: the notice's issued_at plus 30 minutes."
    },
    "window": {
      "type": "object",
      "title": "Window",
      "additionalProperties": false,
      "required": [
        "start",
        "end"
      ],
      "properties": {
        "start": {
          "$ref": "#/$defs/timestamp"
        },
        "end": {
          "$ref": "#/$defs/timestamp"
        }
      }
    }
  },
  "$defs": {
    "timestamp": {
      "type": "string",
      "pattern": "^\\d{4}-\\d{2}-\\d{2}T\\d{2}:\\d{2}:\\d{2}(\\.\\d+)?[+-]\\d{2}:\\d{2}$",
      "title": "Timestamp"
    },
    "session": {
      "type": "object",
      "title": "AffectedSession",
      "additionalProperties": false,
      "required": [
        "patient_id",
        "clinic_id",
        "start",
        "end"
      ],
      "properties": {
        "patient_id": {
          "type": "string",
          "pattern": "^P\\d{3}$"
        },
        "clinic_id": {
          "type": "string",
          "pattern": "^(C|H)\\d{2}$"
        },
        "start": {
          "$ref": "#/$defs/timestamp"
        },
        "end": {
          "$ref": "#/$defs/timestamp"
        }
      }
    }
  }
}
