{
  "closed_clinic_ids": [
    "C01"
  ],
  "sessions": [
    {
      "patient_id": "P001",
      "clinic_id": "C01",
      "start": "2026-10-28T06:00:00-07:00",
      "end": "2026-10-28T10:00:00-07:00"
    },
    {
      "patient_id": "P002",
      "clinic_id": "C01",
      "start": "2026-10-27T15:00:00-07:00",
      "end": "2026-10-27T19:00:00-07:00"
    },
    {
      "patient_id": "P003",
      "clinic_id": "C01",
      "start": "2026-10-29T06:00:00-07:00",
      "end": "2026-10-29T10:00:00-07:00"
    },
    {
      "patient_id": "P004",
      "clinic_id": "C01",
      "start": "2026-10-29T06:00:00-07:00",
      "end": "2026-10-29T09:30:00-07:00"
    },
    {
      "patient_id": "P005",
      "clinic_id": "C01",
      "start": "2026-10-28T10:30:00-07:00",
      "end": "2026-10-28T14:30:00-07:00"
    }
  ],
  "home_in_outage": {
    "P001": true,
    "P002": true,
    "P003": false,
    "P004": false,
    "P005": false
  },
  "mode": "early",
  "lead_hours": 33.0,
  "now": "2026-10-26T09:00:00-07:00",
  "window": {
    "start": "2026-10-27T18:00:00-07:00",
    "end": "2026-10-29T12:00:00-07:00"
  }
}
